{
  "id": "synthetic-product-design",
  "status": "accepted",
  "owner": "Product owner",
  "lastVerified": "2026-08-05",
  "productContext": { "productProfile": "profile-1", "inventory": "inventory-1", "iaApprovalId": "ia-approval-1", "domainPlaybook": "analytics-1" },
  "inheritance": {
    "foundation": { "source": "product-os:0.1", "owner": "Product OS Owner" },
    "domain": { "source": "playbook:analytics-1", "owner": "Product OS Owner" },
    "clientBrand": { "source": "brand:synthetic-1", "owner": "Organization administrator" },
    "product": { "source": "product:synthetic-1", "owner": "Product owner" },
    "organizationTheme": { "source": "theme:default-light", "owner": "Organization administrator" },
    "userPreferences": { "allowed": ["appearance", "contrast", "density", "motion"] }
  },
  "foundations": {
    "tokenSets": [{ "id": "semantic-foundation", "scope": "foundation", "semanticOnly": true, "productSpecific": false, "tokens": [{ "name": "--background", "role": "page surface" }] }],
    "typography": { "bodyFamily": "Inter", "source": "bundled", "scale": ["body", "heading"], "numeric": { "family": "Inter", "tabular": true, "decimalAlignment": true } },
    "spacing": { "basePx": 4, "scale": [4, 8, 12, 16, 24, 32] },
    "radii": { "scale": [0, 8, 12, 999] },
    "shadows": { "permitted": ["none", "overlay"] },
    "iconography": { "library": "Lucide", "defaultStrokeWidth": 1.5, "largeStrokeWidth": 1.25, "minimumSizePx": 14 }
  },
  "density": { "rule": "job-based", "focus": "bounded", "scan": "fixed-grid" },
  "composition": { "primitiveDefault": "shadcn", "focusMaxWidthPx": 560, "readingMeasureCh": 65, "scanGridRequired": true },
  "responsive": { "mobile": { "minimumTargetPx": 44, "safeArea": true, "reflow": "intentional", "copilotTreatment": "sheet" }, "tablet": { "reviewed": true }, "desktop": { "reviewed": true } },
  "accessibility": { "standard": "WCAG 2.2 AA", "keyboard": true, "screenReader": true, "contrast": true, "reducedMotion": true },
  "voice": { "register": "plain-concrete", "rules": ["name what happened", "state the next action", "admit uncertainty"] },
  "themes": { "organizationOwned": true, "variants": ["default-light", "default-dark"], "userSelectable": ["appearance", "contrast", "density", "motion"] },
  "authentication": { "provider": "WorkOS AuthKit", "states": ["login", "invitation", "recovery", "email-verification", "mfa", "organization-choice", "organization-switch", "sso-routing", "session-expiry", "access-denied", "loading", "recoverable-error"] },
  "stateBehavior": { "requiredStates": ["default", "hover", "focus", "active", "disabled", "loading", "error", "empty", "success", "cancel"] },
  "motion": { "honestProgress": true, "reducedMotion": true, "fabricatedPercentage": false },
  "feedback": { "success": "near-action", "error": "cause-and-next-step", "consequential": "explicit-confirmation" },
  "forbiddenPatterns": ["silent restyling", "unowned palette", "fabricated progress"],
  "references": [{ "id": "ref-perplexity-desktop", "state": "accepted", "locator": "evidence:reviewed-screenshot", "extracted": "focus surface" }],
  "rules": [{ "id": "rule-focus", "statement": "Focus surfaces remain bounded.", "sources": [{ "referenceId": "ref-perplexity-desktop", "state": "accepted" }] }],
  "shadcnInputs": [{ "registrySource": "https://ui.shadcn.com", "upstreamVersion": "synthetic-commit", "recordedHash": "aaaaaaaaaaaaaaaaaaaaaaaaaaaaaaaaaaaaaaaaaaaaaaaaaaaaaaaaaaaaaaaa", "resolvedHash": "aaaaaaaaaaaaaaaaaaaaaaaaaaaaaaaaaaaaaaaaaaaaaaaaaaaaaaaaaaaaaaaa", "verification": "matched", "installedFiles": ["src/components/ui/button.tsx"], "localDeviations": [] }],
  "variations": [],
  "approval": { "owner": "Product owner", "decision": "accepted", "approvedAt": "2026-08-05T12:00:00Z" }
}
